{
  "$schema": "http://json-schema.org/draft-07/schema#",
  "$id": "https://pinder.dk-eigenvektor.de/schemas/character-v2.json",
  "title": "Pinder Character v2",
  "description": "On-disk shape of a Pinder character file. Describes player-authored allocation only; bonuses from items/anatomy are recomputed at load time and never serialised here.",
  "type": "object",
  "additionalProperties": false,
  "required": [
    "schema_version",
    "character_id",
    "name",
    "gender_identity",
    "level",
    "items",
    "anatomy",
    "allocation"
  ],
  "$comment": "Issue #779: psychological_stake is optional — omitted from required so legacy files without it remain valid. New files and regenerated stakes write it directly.",
  "properties": {
    "schema_version": {
      "type": "integer",
      "description": "Schema version. v2 files MUST be exactly 2 (issue #1175: anatomy is float [0..1], was v1 string tier ids).",
      "const": 2
    },
    "character_id": {
      "type": "string",
      "description": "UUIDv4 identity. Stable across renames; the filename slug is presentation only.",
      "pattern": "^[0-9a-fA-F]{8}-[0-9a-fA-F]{4}-4[0-9a-fA-F]{3}-[89abAB][0-9a-fA-F]{3}-[0-9a-fA-F]{12}$"
    },
    "name": {
      "type": "string",
      "minLength": 1,
      "description": "Display name shown to opposing player and used in prompts."
    },
    "gender_identity": {
      "type": "string",
      "minLength": 1,
      "description": "Free-form gender identity string (e.g. \"he/him\", \"they/them\")."
    },
    "bio": {
      "type": "string",
      "description": "Generated public-facing profile bio. Optional on legacy files until synthesis completes."
    },
    "level": {
      "type": "integer",
      "minimum": 1,
      "maximum": 11,
      "description": "Character level used for archetype eligibility and starter-points budget."
    },
    "timing_profile_id": {
      "type": "string",
      "minLength": 1,
      "description": "Optional base response timing profile id resolved against data/timing/response-profiles.json. Missing values use average-responder when a timing repository is supplied."
    },
    "items": {
      "type": "array",
      "items": {
        "type": "string",
        "minLength": 1
      },
      "description": "Equipped item ids; resolved against IItemRepository at load."
    },
    "anatomy": {
      "type": "object",
      "additionalProperties": {
        "type": "number",
        "minimum": 0,
        "maximum": 1
      },
      "propertyNames": {
        "not": {
          "enum": [
            "sad",
            "happy",
            "serius",
            "venicus",
            "blemishes"
          ]
        }
      },
      "description": "Anatomy scalars: parameter id (e.g. \"trunkLengthBase\") -> normalised float [0..1] value (issue #1175)."
    },
    "surface_material": {
      "type": "object",
      "additionalProperties": false,
      "required": [
        "smoothness",
        "freckles_pattern_id",
        "surface_layers"
      ],
      "description": "Typed material-surface controls with Unity-authored numeric ranges. Pattern ids are host-resolved strings, not scalar anatomy bands.",
      "properties": {
        "smoothness": {
          "type": "number",
          "minimum": 0,
          "maximum": 100
        },
        "freckles_pattern_id": {
          "type": "string",
          "minLength": 1
        },
        "surface_layers": {
          "type": "array",
          "minItems": 2,
          "maxItems": 2,
          "items": {
            "type": "object",
            "additionalProperties": false,
            "required": [
              "strength",
              "tiling",
              "rotation",
              "pattern_id"
            ],
            "properties": {
              "strength": {
                "type": "number",
                "minimum": 0,
                "maximum": 2
              },
              "tiling": {
                "type": "number",
                "minimum": 1,
                "maximum": 50
              },
              "rotation": {
                "type": "number",
                "minimum": 0,
                "maximum": 10
              },
              "pattern_id": {
                "type": "string",
                "minLength": 1
              }
            }
          }
        }
      }
    },
    "psychological_stake": {
      "type": "string",
      "description": "Issue #779: permanent psychological stake generated at character-creation time. Markdown bullet list of the character's core emotional motivations and vulnerabilities as injected into their LLM system prompt. Optional — absent on legacy files until regenerated."
    },
    "consolidated_personality": {
      "type": "string",
      "description": "Standardized personality generated only from raw personality fragments and used by runtime prompts."
    },
    "consolidated_backstory": {
      "type": "string",
      "description": "Standardized backstory source generated only from raw backstory fragments before final backstory synthesis."
    },
    "stake_lines": {
      "type": "array",
      "minItems": 15,
      "maxItems": 15,
      "items": {
        "type": "string",
        "minLength": 1
      },
      "description": "Structured psychological stakes used by runtime prompts. Complete synthesized characters contain exactly 15 entries."
    },
    "psychiatric_diagnosis": {
      "type": "object",
      "additionalProperties": false,
      "required": [
        "derived_feeling",
        "defense_reaction",
        "safe_connection",
        "hurt_protection",
        "repair_requirement",
        "charm_reaction",
        "rizz_reaction",
        "honesty_reaction",
        "chaos_reaction",
        "wit_reaction",
        "self_awareness_reaction"
      ],
      "description": "Therapist synthesis required by cognitive subtext when the character is used as the datee.",
      "properties": {
        "derived_feeling": {
          "type": "string",
          "minLength": 1
        },
        "defense_reaction": {
          "type": "string",
          "minLength": 1
        },
        "safe_connection": {
          "type": "string",
          "minLength": 1
        },
        "hurt_protection": {
          "type": "string",
          "minLength": 1
        },
        "repair_requirement": {
          "type": "string",
          "minLength": 1
        },
        "charm_reaction": {
          "type": "string",
          "minLength": 1
        },
        "rizz_reaction": {
          "type": "string",
          "minLength": 1
        },
        "honesty_reaction": {
          "type": "string",
          "minLength": 1
        },
        "chaos_reaction": {
          "type": "string",
          "minLength": 1
        },
        "wit_reaction": {
          "type": "string",
          "minLength": 1
        },
        "self_awareness_reaction": {
          "type": "string",
          "minLength": 1
        }
      }
    },
    "backstory_categories": {
      "type": "object",
      "description": "Issue #1259: The 20-category detailed backstory array mapping out their history and lies.",
      "additionalProperties": false,
      "required": [
        "age_and_demographics",
        "birthplace_and_origin",
        "childhood_milieu",
        "parental_dynamics",
        "early_education_scars",
        "higher_education",
        "formative_intimacies",
        "career_debut",
        "current_profession",
        "financial_hygiene",
        "domestic_milieu",
        "social_circle",
        "recent_ex",
        "career_low",
        "delusional_plan",
        "hyperfixations",
        "ideological_posture",
        "digital_footprint",
        "physical_dysmorphia",
        "dependencies"
      ],
      "patternProperties": {
        "^[a-z_]+$": {
          "type": "object",
          "additionalProperties": false,
          "required": [
            "bio_lie",
            "tragic_reality"
          ],
          "properties": {
            "bio_lie": {
              "type": "string"
            },
            "tragic_reality": {
              "type": "string"
            }
          }
        }
      }
    },
    "allocation": {
      "type": "object",
      "additionalProperties": false,
      "required": [
        "spent",
        "unspent_pool",
        "shadows"
      ],
      "description": "Player-authored build-point allocation block. Bonuses NOT included here.",
      "properties": {
        "spent": {
          "type": "object",
          "additionalProperties": false,
          "required": [
            "charm",
            "rizz",
            "honesty",
            "chaos",
            "wit",
            "self_awareness"
          ],
          "properties": {
            "charm": {
              "type": "integer",
              "minimum": 0
            },
            "rizz": {
              "type": "integer",
              "minimum": 0
            },
            "honesty": {
              "type": "integer",
              "minimum": 0
            },
            "chaos": {
              "type": "integer",
              "minimum": 0
            },
            "wit": {
              "type": "integer",
              "minimum": 0
            },
            "self_awareness": {
              "type": "integer",
              "minimum": 0
            }
          }
        },
        "unspent_pool": {
          "type": "integer",
          "minimum": 0,
          "description": "Build points not yet allocated. Starter files all set this to 0."
        },
        "shadows": {
          "type": "object",
          "additionalProperties": false,
          "required": [
            "madness",
            "despair",
            "denial",
            "fixation",
            "dread",
            "overthinking"
          ],
          "properties": {
            "madness": {
              "type": "integer",
              "minimum": 0
            },
            "despair": {
              "type": "integer",
              "minimum": 0
            },
            "denial": {
              "type": "integer",
              "minimum": 0
            },
            "fixation": {
              "type": "integer",
              "minimum": 0
            },
            "dread": {
              "type": "integer",
              "minimum": 0
            },
            "overthinking": {
              "type": "integer",
              "minimum": 0
            }
          }
        }
      }
    }
  }
}
