{
  "schema_version": 2,
  "character_id": "8bde182a-9aec-4c15-b8f9-2f6edeb30752",
  "name": "Sable_xo",
  "gender_identity": "she/her",
  "bio": "A rising star in urban planning who appreciates clean lines, structural integrity, and the perfect mathematical proportions of a well-designed city. Looking for a partner with a strong foundation who appreciates a curated life, is ready for a joint venture, and doesn't mind explaining the finer points of high school physics over a single-origin espresso.",
  "level": 3,
  "timing_profile_id": "eager-texter",
  "items": [
    "hair2",
    "outfit_maid",
    "face_eyes2"
  ],
  "anatomy": {
    "trunkLengthBase": 0.52,
    "trunkLengthMid": 0.48,
    "trunkLengthTip": 0.51,
    "trunkGirth": 0.53,
    "trunkCurvature": 0.47,
    "glansScale": 0.5,
    "glansWidth": 0.49,
    "scrotumScale": 0.52,
    "leftTesticleScale": 0.48,
    "rightTesticleScale": 0.51,
    "scrotumDrop": 0.5,
    "prepucius": 0.53,
    "arrugatis": 0.47,
    "gravitatis": 0.5,
    "venicus": 0.48,
    "skinHue": 0.48,
    "skinSat": 0.52,
    "skinVal": 0.5,
    "freckles": 0.49,
    "blemishes": 0.51,
    "veins": 0.5,
    "isCircumcised": 0
  },
  "allocation": {
    "spent": {
      "charm": 4,
      "rizz": 8,
      "honesty": 2,
      "chaos": 3,
      "wit": 2,
      "self_awareness": 2
    },
    "unspent_pool": 0,
    "shadows": {
      "madness": 3,
      "despair": 0,
      "denial": 2,
      "fixation": 5,
      "dread": 2,
      "overthinking": 4
    }
  },
  "psychological_stake": "- The most humiliating thing that happened to me this week was when my leftward lean calculation was exposed at the 2023 Boston Bridge Summit.\n- The thing about my body I'm convinced everyone notices but actually no one does is my asymmetrical curvature during presentation slide decks.\n- My last sexual accident or mishap was when I panicked and asked Marcus if he meant to text someone else.\n- The kink I've never said out loud to anyone is wanting Marcus to explain basic high school physics to me.\n- The substance I leaned on harder than I should have last month was Beta-blockers and I used it to stop shaking during the 2024 zoning meeting.\n- The most embarrassing impulse purchase on my last bank statement is a eighty-dollar architectural ruler from the Harvard Coop to look smart.\n- If you opened my browser history at 3am last Tuesday you'd find searches for \"how to calculate structural load Becky 2008.\"\n- The last lie I told on a dating profile or in a chat was that I graduated from the MIT School of Architecture.\n- The most undignified thing my body did in public recently was visibly trembling when the lead engineer at Arup Group asked for my blueprints.\n- The thing I do alone in my apartment that I'd be humiliated to be filmed doing is practicing saying the word \"cantilever\" in the mirror.\n- The single object in my bedroom I could not explain to a stranger is the unopened 2018 civil engineering textbook I use as a prop.\n- The last time I cried and where it happened was in the handicap stall of the Starbucks on Boylston Street after failing CAD.\n- My last named ex was Julian and the specific reason it ended was my constant texting anxiety during our 2022 trip to Maine.\n- The lowest professional moment of the last year was when I was quietly removed from the Chelsea Creek Bridge rehabilitation project.\n- The thing I genuinely believe will happen to me in the next two years that everyone else would call delusional is marrying a wealthy developer from Beacon Hill.",
  "consolidated_personality": "Sable_xo presents herself with a seasoned, unhurried gravity that makes people default to assuming her competence and good intent. Beneath her warm, rumbling confidence and a seemingly comfortable, steady cadence lies a highly calculated mind that has already spreadsheeted every possible outcome. She negotiates her presence deliberately, using her eyes to signal what she is not yet ready to say aloud, while maintaining a mild ambient pleasantness and refusing to sand down her textured history for anyone's comfort. Under pressure, she texts with a sparse, minimal pacing, offering quiet comfort and simple, honest friendliness while deflecting vulnerability with gentle humor. She fiercely defends her personal boundaries, claiming her leftward lean is a subtle artistic inflection, asserting her base length is the gold standard of civil engineering, and flatly refusing to discuss her proportions further. While she wants genuine connection and offers a sympathetic, seasoned ear to make others feel safe, her deep-seated fear of rejection causes her to repeatedly ask matches if they are sure they didn't mean to text someone else. Ultimately, she channels her biography into a steady, moderate pulse, keeping conversations safe, conventional, and unbothered while watching closely to see who responds to her carefully curated costume versus the real person underneath.",
  "consolidated_backstory": "Sable grew up in a forgettable environment where she learned to define herself by adjectives entirely unrelated to her physical form. Her body resolved cleanly and proportionally in her youth, leaving her with a tidy, uncomplicated physical confidence that she never felt the need to worry over. Because of her pleasant face, she was waved through doors and handed responsibilities in her twenties that she had not yet earned. Realizing that ambient goodwill was a tool, she spent years racing to actually deserve the positions she was given on appearance alone. Over time, so many people read a natural sadness into her face that she simply stopped correcting them, letting the assumption stand to spare herself from tedious small talk. She communicates with a sparse, minimal pacing that implies long pauses between thoughts.",
  "backstory_categories": {
    "age_and_demographics": {
      "bio_lie": "A 29-year-old rising star in urban planning who has effortlessly glided into leadership roles due to her natural charisma.",
      "tragic_reality": "She is 34, desperately trying to outrun the ticking clock of her early-career impostor syndrome before her peers realize she started with zero credentials."
    },
    "birthplace_and_origin": {
      "bio_lie": "Born in a historic, culturally rich metropolitan hub that shaped her refined aesthetic sensibilities.",
      "tragic_reality": "Raised in an aggressively bland, sprawling suburb where the only landmarks were strip malls and identical stucco housing developments."
    },
    "childhood_milieu": {
      "bio_lie": "Raised in an intellectually stimulating household that encouraged independent thought and artistic expression.",
      "tragic_reality": "Grew up in a suffocatingly quiet home where emotional neglect was masked as 'giving her space,' forcing her to learn how to read silent rooms."
    },
    "parental_dynamics": {
      "bio_lie": "Supported by progressive, hands-off parents who trusted her innate sense of responsibility.",
      "tragic_reality": "Raised by parents who were so consumed by their own bitter, silent divorce that they treated her as an invisible, self-cleaning appliance."
    },
    "early_education_scars": {
      "bio_lie": "A consistently top-tier student who skipped grades because of her advanced emotional maturity.",
      "tragic_reality": "Waved through school with easy grades because teachers found her quiet, pretty face non-threatening, leaving her intellectually stunted and scrambling to catch up."
    },
    "higher_education": {
      "bio_lie": "Graduated with honors from a prestigious architecture program where she mastered structural design.",
      "tragic_reality": "Barely finished a general humanities degree, learning just enough design jargon to fake her way into entry-level civil engineering drafting rooms."
    },
    "formative_intimacies": {
      "bio_lie": "Had a series of mature, mutually respectful relationships that ended amicably due to diverging career paths.",
      "tragic_reality": "Spent her twenties letting older, influential men mentor her in exchange for her silence, realizing early on that her quietness was her most marketable asset."
    },
    "career_debut": {
      "bio_lie": "Recruited straight out of college by a high-end firm that recognized her unique spatial vision.",
      "tragic_reality": "Hired as a receptionist at a mid-tier firm because the hiring manager liked her look, then frantically taught herself CAD overnight when they promoted her to fill a sudden vacancy."
    },
    "current_profession": {
      "bio_lie": "A sought-after civil engineering consultant specializing in optimal, standardized base-length infrastructure.",
      "tragic_reality": "A mid-level project coordinator who spends her days hiding behind spreadsheets, terrified a real engineer will ask her to do actual calculus."
    },
    "financial_hygiene": {
      "bio_lie": "Maintains a meticulously balanced portfolio and lives a minimalist, high-end lifestyle.",
      "tragic_reality": "Leases an expensive car and buys designer workwear to maintain her professional facade, living paycheck-to-paycheck on maxed-out credit cards."
    },
    "domestic_milieu": {
      "bio_lie": "Lives in a sparsely furnished, architecturally significant loft that reflects her love for clean lines.",
      "tragic_reality": "Rents a tiny, sterile studio apartment where she keeps her moving boxes packed, ready to flee the moment her professional bluff is called."
    },
    "social_circle": {
      "bio_lie": "Surrounded by a curated group of progressive artists, architects, and forward-thinking intellectuals.",
      "tragic_reality": "Maintains superficial, low-effort friendships with professional acquaintances who only know her as a polite, quiet face at networking events."
    },
    "recent_ex": {
      "bio_lie": "An amicable split from a brilliant designer because their creative energies eventually drifted apart.",